{
  "dataVersion": "1.0.0",
  "generatedOn": "2026-03-08T00:00:00Z",
  "mapId": "legacy_v1",
  "mode": "challenge",
  "variant": "legacy",
  "assets": {
    "backgrounds": {
      "day_1x": "images/challenge/backgrounds/legacy/legacy_map_day_1x.png",
      "day_2x": "images/challenge/backgrounds/legacy/legacy_map_day_2x.png",
      "night_1x": "images/challenge/backgrounds/legacy/legacy_map_night_1x.png",
      "night_2x": "images/challenge/backgrounds/legacy/legacy_map_night_2x.png"
    },
    "letters": {
      "lettersRoot": "images/challenge/backgrounds/legacy_letters/",
      "filePattern": "legacy_letter_{LETTER}_{THEME}_2x.png",
      "themes": ["day", "night"]
    },
    "ui": {
      "tile_base_2x": "images/challenge/ui/legacy/tile_base_2x.png",
      "lock_2x": "images/challenge/ui/legacy/lock_2x.png",
      "star_empty_2x": "images/challenge/ui/legacy/star_empty_2x.png",
      "star_filled_2x": "images/challenge/ui/legacy/star_filled_2x.png"
    }
  },
  "rendering": {
    "coordinateSystem": "normalized_percent",
    "tileAnchor": "center",
    "tileScale": 0.1,
    "minTapRadius": 0.035,
    "safeMargins": {
      "top": 0.06,
      "right": 0.06,
      "bottom": 0.08,
      "left": 0.06
    }
  },
  "unlockModel": {
    "nodeRule": {
      "requiresPreviousNode": true,
      "minStarsToUnlockNextNode": 1,
      "coinBypassEnabled": true
    },
    "subLevelRule": {
      "requiresPreviousSubLevel": true,
      "minStarsToUnlockNextSubLevel": 1
    },
    "economyDefaults": {
      "entryCostCoins": 0,
      "nodeUnlockBypassCostCoins": 40,
      "subLevelUnlockBypassCostCoins": 0,
      "rewardCoinsOnComplete": 25
    }
  },
  "nodes": [
    {
      "nodeId": "A",
      "order": 1,
      "letter": "A",
      "mapTile": { "x": 0.50, "y": 0.86 },
      "unlock": { "requiresNodeId": null, "bypassCostCoins": 0 },
      "subLevels": []
    },
    {
      "nodeId": "B",
      "order": 2,
      "letter": "B",
      "mapTile": { "x": 0.47, "y": 0.82 },
      "unlock": { "requiresNodeId": "A", "bypassCostCoins": 40 },
      "subLevels": []
    },
    {
      "nodeId": "C",
      "order": 3,
      "letter": "C",
      "mapTile": { "x": 0.53, "y": 0.78 },
      "unlock": { "requiresNodeId": "B", "bypassCostCoins": 40 },
      "subLevels": []
    },
    {
      "nodeId": "D",
      "order": 4,
      "letter": "D",
      "mapTile": { "x": 0.58, "y": 0.73 },
      "unlock": { "requiresNodeId": "C", "bypassCostCoins": 40 },
      "subLevels": []
    },
    {
      "nodeId": "E",
      "order": 5,
      "letter": "E",
      "mapTile": { "x": 0.62, "y": 0.69 },
      "unlock": { "requiresNodeId": "D", "bypassCostCoins": 40 },
      "subLevels": []
    },
    {
      "nodeId": "F",
      "order": 6,
      "letter": "F",
      "mapTile": { "x": 0.66, "y": 0.64 },
      "unlock": { "requiresNodeId": "E", "bypassCostCoins": 40 },
      "subLevels": []
    }
  ]
}
